{
  "schema_version": 1,
  "source_digest": "sha256:0000000000000000000000000000000000000000000000000000000000000000",
  "nodes": [
    {"plan_key": "billing", "kind": "epic", "change": "billing", "title": "billing", "body": "OpenSpec change `billing`.", "approval": "approved", "has_spec": true, "depth": 1, "deliverable_kind": null, "covers": [], "acceptance_criteria": []},
    {"plan_key": "billing/invoice", "kind": "story", "change": "billing", "title": "Generate invoices", "body": "## Acceptance criteria\n\n- An invoice is generated.", "approval": "approved", "has_spec": true, "depth": 0, "deliverable_kind": "story", "covers": ["billing/invoicing#Monthly invoice"], "acceptance_criteria": ["An invoice is generated."]},
    {"plan_key": "accounts-api", "kind": "epic", "change": "accounts-api", "title": "accounts-api", "body": "", "approval": "unplanned", "has_spec": false, "depth": 0, "deliverable_kind": null, "covers": [], "acceptance_criteria": []}
  ],
  "parents": [{"child": "billing/invoice", "parent": "billing"}],
  "blocks": [{"blocker": "accounts-api", "blocked": "billing"}],
  "unplanned_changes": []
}
